"Institution"	"EZB-Id"	"Sigel"
"Badische Landesbibliothek Karlsruhe"	"BLB"	"DE-31"
"Bayerische Staatsbibliothek München"	"BSB"	"DE-12"
"Beuth Hochschule für Technik Berlin"	"TFHB"	"DE-B768"
"BfArM-Bibliothek, Bonn"	"BFARM"	"DE-B1512"
"Bibliotheca Hertziana - Max-Planck-Institut für Kunstgeschichte"	"HERTZ"	"DE-Y2"
"Bibliothek der Evangelischen Hochschule Nürnberg"	"EHS"	"DE-1052"
"Bibliothek der FH Landshut"	"FHBLA"	"DE-860"
"Bibliothek der Frankfurt UAS"	"FHF"	"DE-946"
"Bibliothek der HafenCity Universität Hamburg"	"HCUHH"	"DE-1373"
"Bibliothek der HAWK -  Hildesheim/Holzminden/Göttingen"	"HAWK"	""
"Bibliothek der Hochschule für Musik, Theater und Medien Hannover"	"HMT"	"DE-960-3"
"Bibliothek der Hochschule Hannover"	"FHH"	"DE-960-1"
"Bibliothek der Hochschule Mainz"	"FHMZ"	"DE-1053"
"Bibliothek der Hochschule München"	"FHM"	"DE-M347"
"Bibliothek der Hochschule Offenburg"	"FHBOG"	"DE-Ofb1"
"Bibliothek der Hochschule Weihenstephan-Triesdorf"	"FHWEI"	"DE-1028"
"Bibliothek der HS Augsburg"	"FHBA"	"DE-Aug4"
"Bibliothek der Max-Planck-Institute für Chemische Ökologie und Biogeochemie"	"ICE"	"DE-J126"
"Bibliothek der Ostfalia Hochschule für angewandte Wissenschaften"	"FHWF"	"DE-916"
"Bibliothek der Pädagogischen Hochschule Freiburg"	"PHBFR"	"DE-Frei129"
"Bibliothek der Pädagogischen Hochschule Heidelberg"	"PHHD"	"DE-He76"
"Bibliothek der Staatlichen Hochschule für Musik Trossingen"	"MHTRO"	"DE-Trs1"
"Bibliothek der Technischen Hochschule Deggendorf"	"FHDEG"	"DE-1050"
"Bibliothek der Technischen Hochschule Nürnberg Georg Simon Ohm"	"FHN"	"DE-92"
"Bibliothek des Deutschen Forums für Kunstgeschichte Paris"	"DFK"	"DE-Y7"
"Bibliothek des DHI Moskau"	"DHIM"	""
"Bibliothek des Fraunhofer-Instituts für Silicatforschung"	"FRISC"	"DE-W78S"
"Bibliothek des Hamburger Instituts für Sozialforschung"	"HIS"	"DE-H357"
"Bibliothek des Max-Planck-Instituts für Innovation und Wettbewerb und des Max-Planck-Instituts für Steuerrecht und Öffentliche Finanzen"	"IPMPG"	"DE-M382"
"Bibliothek des Wissenschaftsparks Albert Einstein, Potsdam"	"GFZPO"	""
"Bibliothek des Zentralinstituts für Seelische Gesundheit Mannheim"	"ZIM"	"DE-Mh32"
"Bibliothek des Zentrums für Zeithistorische Forschung e.V., Potsdam"	"ZZFPD"	"DE-Po82"
"Bibliotheken der Universität Frankfurt am Main"	"UBFM"	"DE-30"
"Bibliothekssystem der Justus-Liebig-Universität Gießen"	"UBGIE"	"DE-26"
"Bibliothekssystem der Universität Mainz"	"UBMZ"	"DE-77"
"BIS - Bibliotheks- und Informationssystem der Universität Oldenburg"	"BISOL"	"DE-715"
"Bundesanstalt für Materialforschung und -prüfung (BAM)"	"BAM"	"DE-B43"
"Bundesinstitut für Risikobewertung"	"BGVV"	"DE-B12"
"Caritas-Bibliothek Freiburg"	"BDCFR"	"DE-Frei26"
"DESY-Bibliotheken Hamburg/Zeuthen"	"DESY"	""
"Deutsche Hochschule der Polizei, Münster"	"DHPOL"	""
"Deutsches Archäologisches Institut, Abteilung Rom - Bibliothek"	"DAIRO"	"DE-Y1"
"Deutsches Archäologisches Institut (DAI), Abteilung Istanbul"	"DAIIN"	""
"Deutsches Archäologisches Institut (DAI), Abteilung Madrid"	"DAIMA"	""
"Deutsches Archäologisches Institut (DAI), Aussenstelle Damaskus der Orient-Abteilung"	"DAIDA"	""
"Deutsches Archäologisches Institut (DAI), Außenstelle Sana'a der Orient-Abteilung"	"DAISA"	""
"Deutsches Archäologisches Institut (DAI), Eurasien-Abteilung"	"DAIEA"	"DE-B523"
"Deutsches Archäologisches Institut (DAI), Kommission für Alte Geschichte und Epigraphik München (AEK)"	"DAIAE"	"DE-M491"
"Deutsches Archäologisches Institut (DAI), Kommission für Archäologie Außereuropäischer Kulturen (KAAK) Bonn"	"DAIBO"	"DE-Bo405"
"Deutsches Archäologisches Institut (DAI) Orientabteilung"	"DAIOA"	""
"Deutsches Archäologisches Institut (DAI), Römisch-Germanische Kommission (RGK)"	"DAIRG"	"DE-F36"
"Deutsches Archäologisches Institut (DAI), Zentrale Berlin"	"DAI"	"DE-B99"
"Deutsches Historisches Institut London"	"GHL"	""
"Deutsches Historisches Institut Paris"	"DHIP"	""
"Deutsches Historisches Institut Warschau"	"DHIW"	""
"Deutsches Institut für Internationale Pädagogische Forschung"	"DIPF"	""
"Deutsches Institut für Japanstudien, Bibliothek"	"DIJ"	"DE-Y5"
"Deutsches Institut für Menschenrechte - Bibliothek"	"DIM"	"DE-B1547"
"Deutsches Institut für Wirtschaftsforschung Berlin"	"DIW"	"DE-B554"
"Deutsches Patent- und Markenamt / Bibliothek, München"	"DPMA"	"DE-201"
"Deutsches Zentrum für Neurodegenerative Erkrankungen"	"DZNE"	""
"DLR - Deutsches Zentrum für Luft- und Raumfahrt"	"DLLR"	"DE-Kn182"
"Evangelische Hochschule Freiburg - Hochschulbibliothek"	"EHF"	"DE-Frei160"
"Fachhochschulbibliothek Dortmund"	"FHBDO"	"DE-Dm13"
"Fachhochschulbibliothek Münster"	"FHBMS"	"DE-836"
"FH Potsdam, Hochschulbibliothek"	"FHPO"	"DE-525"
"Forschungsstelle Amman am Deutschen Evangelischen Institut (DEI)"	"DAIAM"	""
"Forschungsstelle Jerusalem am Deutschen Evangelischen Institut (DEI)"	"DAIJE"	""
"Forschungszentrum Jülich GmbH, Zentralbibliothek"	"FZJUE"	"DE-Juel1"
"Fraunhofer-Gesellschaft"	"FRAHG"	""
"Fraunhofer ICT-IMM"	"IMMMZ"	""
"Fraunhofer-Institut für Angewandte Optik und Feinmechanik IOF Jena"	"IOF"	""
"Fraunhofer-Institut für Arbeitswirtschaft und Organisation"	"FIAO"	"DE-Stg191"
"Fraunhofer-Institut für Keramische Technologien und Systeme IKTS, Dresden, Hermsdorf"	"FRIKT"	""
"Fraunhofer-Institut für Werkstoff- und Strahltechnik, IWS Dresden"	"FRIWS"	""
"Fritz-Haber-Institut der Max-Planck-Gesellschaft, Berlin"	"FHI"	"DE-B113"
"Führungsakademie der Bundeswehr: Fachinformationsstelle / Bibliothek"	"FAB"	"DE-H256"
"GEOMAR Bibliothek - Helmholtz-Zentrum für Ozeanforschung Kiel"	"IFMAR"	"DE-Ki109"
"GIGA German Institute of Global and Area Studies - Informationszentrum, Hamburg"	"GIGA"	"DE-H221"
"Gottfried Wilhelm Leibniz Bibliothek - Niedersächsische Landesbibliothek"	"GWLB"	"DE-35"
"GSI-Bibliothek"	"GSI"	"DE-Ds200"
"Helmholtz-Zentrum Berlin - Zentralbibliothek"	"HMIB"	"DE-B1505"
"Helmholtz-Zentrum Dresden-Rossendorf e.V."	"FZR"	"DE-D120"
"Helmholtz-Zentrum für Infektionsforschung, Braunschweig - Bibliothek"	"GBF"	"DE-Bs80"
"Helmholtz-Zentrum für Umweltforschung GmbH - UFZ"	"UFZ"	"DE-L97"
"Helmholtz-Zentrum Geesthacht, Bibliothek"	"GKSS"	"DE-Gt1"
"Helmholtz Zentrum München - Zentralbibliothek"	"GSF"	""
"Hertie School of Governance"	"HSG"	"DE-B1570"
"Hochschulbibliothek der Fachhochschule Aachen"	"FHBAA"	"DE-A96"
"Hochschulbibliothek der FH Bielefeld"	"FHBI"	"DE-Bi10"
"Hochschulbibliothek der Hochschule Bochum"	"FHBO"	"DE-Bm40"
"Hochschulbibliothek der Hochschule Düsseldorf"	"FHD"	"DE-Due62"
"Hochschulbibliothek der Hochschule Niederrhein"	"HSNRH"	"DE-829"
"Hochschulbibliothek der HTWG Konstanz"	"FHKN"	"DE-Kon4"
"Hochschulbibliothek der HTWK Leipzig"	"HTWK"	"DE-L189"
"Hochschulbibliothek EAH Jena"	"FHJ"	"DE-J59"
"Hochschulbibliothek Emden/Leer"	"FHOOW"	"DE-755"
"Hochschulbibliothek Heilbronn"	"FHHN"	"DE-840"
"Hochschulbibliothek Karlsruhe"	"HSBKA"	"DE-751"
"Hochschulbibliothek Kempten"	"FHBKA"	"DE-859"
"Hochschulbibliothek Magdeburg-Stendal"	"HBMST"	"DE-551"
"Hochschulbibliothek Mittweida"	"HTWM"	"DE-Mit1"
"Hochschulbibliothek Neubrandenburg"	"FHNB"	"DE-519"
"Hochschulbibliothek OTH Regensburg"	"FHBR"	"DE-898"
"Hochschulbibliothek Pforzheim"	"FHPF"	""
"Hochschulbibliothek Wismar"	"HSHWI"	"DE-Wis1"
"Hochschulbibliothek Würzburg-Schweinfurt"	"FHBWS"	"DE-863"
"Hochschule Fresenius, Idstein"	"EFF"	"DE-1126"
"Hochschule für Gesundheit"	"HFG"	"DE-1866"
"Hochschule für Technik und Wirtschaft (FH) Dresden"	"HTWDD"	"DE-520"
"Hochschule Karlsruhe - Technik und Wirtschaft HsKA"	"FBHKA"	"DE-90-4"
"Hochschule Koblenz RheinAhrCampus Remagen"	"HKRAC"	"DE-1105"
"Hochschule Osnabrück - Bibliothek"	"FHOS"	"DE-959"
"Hochschule Reutlingen - Lernzentrum"	"FHRT"	"DE-Rt2"
"Hochschule Rhein-Waal"	"HRW"	""
"Hochschulinformations- und Bibliotheksservice (HIBS) der HAW-Hamburg"	"HAWHH"	""
"Hochschul- und Kreisbibliothek Bonn-Rhein-Sieg"	"FHBRS"	"DE-1044"
"Hochschul- und Landesbibliothek Fulda"	"FHFD"	"DE-66"
"Hochschul- und Landesbibliothek RheinMain"	"HLB"	"DE-43"
"HSFK-Bibliothek Frankfurt am Main"	"HSFK"	"DE-F197"
"Humboldt-Universität zu Berlin"	"UBHUB"	"DE-11-10"
"IfADo - Leibniz-Institut für Arbeitsforschung an der TU Dortmund - Bibliothek"	"IFADO"	"DE-Dm21"
"Institut für Arbeitsmarkt- und Berufsforschung, Nürnberg"	"IAB"	""
"Institut für Deutsche Sprache (IDS)"	"IDS"	"DE-Mh39"
"IPN Bibliothek, Kiel"	"IPN"	"DE-Ki128"
"IZUS / Universitätsbibliothek Stuttgart"	"UBS"	"DE-93"
"Jade Hochschule Wilhelmshaven/Oldenburg/Elsfleth, Hochschulbibliothek"	"FHWOE"	"DE-839"
"Karlsruher Institut für Technologie KIT"	"KIT"	"DE-90"
"Katholische Hochschule Nordrhein-Westfalen (KatHO NRW) - Hochschulbibliothek"	"KHN"	"DE-1032"
"KIM Konstanz, IT- und Bibliotheksdienste"	"UBKO"	"DE-352"
"Kommunikations-, Informations- und Medienzentrum Hohenheim (KIM)"	"UBHOH"	"DE-100"
"Kunsthistorisches Institut in Florenz, Max-Planck-Institut"	"KHIFI"	"DE-Y3"
"Landeskirchliche Bibliothek Bremen"	"LBBEK"	"DE-Bre4"
"Leibniz-Institut für Astrophysik Potsdam"	"AIP"	"DE-B33"
"Leibniz-Institut für Länderkunde, Geographische Zentralbibliothek, Leipzig"	"GZB"	"DE-185"
"Leibniz-Institut für Nutztierbiologie, Dummerstorf"	"FBN"	"DE-R48"
"Leibniz-Institut für Raumbezogene Sozialforschung (IRS)"	"IRS"	"DE-B567"
"Mathematisches Forschungsinstitut Oberwolfach gGmbH"	"MFO"	"DE-Frei3c"
"Max-Delbrück-Centrum für Molekulare Medizin (MDC), Berlin"	"MDCB"	"DE-B2225"
"Max Planck Institute for Plant Breeding"	"MPIZ"	"DE-Vol1"
"Max-Planck-Institute für Biochemie u. Neurobiologie, Martinsried"	"MPIBC"	"DE-M411"
"Max-Planck-Institute Stuttgart"	"MPIS"	"DE-Stg113"
"Max-Planck-Institute Tübingen"	"MPIT"	"DE-B107"
"Max-Planck-Institut für Astronomie, Heidelberg"	"MPIAS"	"DE-He81"
"Max-Planck-Institut für Astrophysik/extraterrestrische Physik, Garching"	"MPAEP"	"DE-B161a"
"Max-Planck-Institut für ausländisches öffentliches Recht und Völkerrecht"	"MPIV"	"DE-B208"
"Max-Planck-Institut für ausländisches und internationales Privatrecht, Hamburg"	"MPIPR"	"DE-B212"
"Max-Planck-Institut für ausländisches und internationales Strafrecht, Freiburg i. Br."	"MPAI"	"DE-Frei85"
"Max-Planck-Institut für Bildungsforschung, Berlin"	"MPIBF"	"DE-B1532"
"Max-Planck-Institut für biophysikalische Chemie, Göttingen"	"MPIBP"	"DE-Goe116"
"Max-Planck-Institut für Chemie, Mainz"	"MPICH"	"DE-Mz4"
"Max-Planck-Institut für Chemische Physik fester Stoffe, Dresden"	"CPFS"	"DE-D210"
"Max-Planck-Institut für demographische Forschung, Rostock"	"MPIDF"	""
"Max-Planck-Institut für Dynamik komplexer technischer Systeme, Magdeburg"	"MPIDS"	"DE-Ma54"
"Max-Planck-Institut für Dynamik und Selbstorganisation, Göttingen"	"MPISF"	""
"Max-Planck-Institut für Eisenforschung"	"MPIE"	"DE-Due57"
"Max-Planck-Institut für empirische Ästhetik"	"MPIAE"	"DE-2177"
"Max-Planck-Institut für Ethnologische Forschung, Halle"	"MPIEF"	"DE-Ha163"
"Max-Planck-Institut für europäische Rechtsgeschichte, Frankfurt/Main"	"MPIER"	"DE-F137"
"Max-Planck-Institut für evolutionäre Anthropologie, Leipzig"	"MPIEA"	"DE-L321"
"Max-Planck-Institut für Evolutionsbiologie, Plön"	"MPIL"	"DE-Pn1"
"Max-Planck-Institut für experimentelle Medizin, Göttingen"	"MPIEM"	"DE-Goe134"
"Max-Planck-Institut für Gesellschaftsforschung, Köln"	"MPIFG"	"DE-Kn188"
"Max-Planck-Institut für Gravitationsphysik, Golm"	"AEI"	"DE-Po62"
"Max-Planck-Institut für Herz- und Lungenforschung, W.G. Kerckhoff-Institut, Bad Nauheim"	"MPIPK"	"DE-Nau1"
"Max-Planck-Institut für Immunbiologie Freiburg"	"MPIIM"	"DE-Frei106"
"Max-Planck-Institut für Infektionsbiologie"	"MPIIB"	""
"Max-Planck-Institut für Informatik Saarbrücken Max Planck Institute for Software Systems Kaiserslautern/Saarbrücken"	"MPII"	"DE-Sa18"
"Max-Planck-Institut für Kernphysik, Heidelberg"	"MPIKP"	"DE-He74"
"Max-Planck-Institut für Kognitions- und Neurowissenschaften, Leipzig"	"MPINF"	"DE-L322"
"Max-Planck-Institut für Kolloid- und Grenzflächenforschung, Golm"	"MPIKG"	"DE-Po81"
"Max-Planck-Institut für marine Mikrobiologie, Bremen"	"MPIMM"	"DE-Bre11"
"Max-Planck-Institut für Mathematik, Bonn"	"MPIMA"	"DE-Bo206"
"Max-Planck-Institut für Mathematik in den Naturwissenschaften, Leipzig"	"MPIMN"	"DE-L323"
"Max-Planck-Institut für medizinische Forschung, Heidelberg"	"MPIMF"	"DE-He43"
"Max-Planck-Institut für  Menschheitsgeschichte, Jena"	"MPIEW"	"DE-J152"
"Max-Planck-Institut für Meteorologie, Hamburg"	"MPIM"	""
"Max-Planck-Institut für Mikrostrukturphysik, Halle"	"MPIMS"	"DE-Ha94"
"Max-Planck-Institut für molekulare Genetik, Berlin"	"MOLGE"	"DE-B787"
"Max-Planck-Institut für molekulare Pflanzenphysiologie, Golm"	"MPIMP"	"DE-Po80"
"Max-Planck-Institut für molekulare Physiologie, Dortmund"	"EZBDO"	"DE-Dm1"
"Max-Planck-Institut für Molekulare Zellbiologie und Genetik, Dresden"	"CBG"	"DE-D267"
"Max-Planck-Institut für Ornithologie, Seewiesen"	"MPFO"	"DE-Star1"
"Max-Planck-Institut für Physik komplexer Systeme, Dresden"	"PKS"	"DE-D206"
"Max-Planck-Institut für Plasmaphysik"	"MPIPP"	"DE-M359"
"Max-Planck-Institut für Polymerforschung, Mainz"	"MPIP"	"DE-Mz116"
"Max-Planck-Institut für Psychiatrie"	"MPGPS"	"DE-M68"
"Max-Planck-Institut für Psycholinguistik, Nijmegen"	"MPIPL"	"DE-Y4"
"Max-Planck-Institut für Quantenoptik, Garching"	"MPQUA"	"DE-M484"
"Max-Planck-Institut für Radioastronomie, Bonn"	"MPIFR"	"DE-Bo146"
"Max-Planck-Institut für Sonnensystemforschung, Göttingen"	"MPAE"	"DE-Lin1b"
"Max-Planck-Institut für Sozialrecht und Sozialpolitik, München"	"MPISR"	"DE-M477"
"Max-Planck-Institut für terrestrische Mikrobiologie, Marburg"	"MPITM"	""
"Max-Planck-Institut für Wissenschaftsgeschichte, Berlin"	"MPIWG"	"DE-B2226"
"Max-Planck-Institut zur Erforschung multireligiöser und multiethnischer Gesellschaften"	"MPIG"	"DE-Goe164"
"Max-Planck-Institut zur Erforschung von Gemeinschaftsgütern, Bonn"	"MPPRG"	"DE-Bo407"
"Max Rubner-Institut, Bundesforschungsinstitut für Ernährung und Lebensmittel"	"BFEL"	""
"Medienzentrum der Hochschule Darmstadt"	"FHDA"	"DE-Ds114"
"Medizinische Bibliothek der Charité"	"MBCB"	"DE-578-e"
"MHH-Bibliothek / Medizinische Hochschule Hannover"	"MHH"	"DE-354"
"Niedersächsische Staats- und Universitätsbibliothek Göttingen"	"SUBGO"	"DE-7"
"NTNM-Bibliothek - Leibniz Institut für Neue Materialien gGmbH"	"INM"	"DE-291-415"
"Orient-Institut Istanbul"	"ORI"	""
"Pädagogische Hochschulbibliothek Ludwigsburg"	"PHLB"	"DE-Lg1"
"Pädagogische Hochschule Schwäbisch Gmünd - Bibliothek"	"PHGD"	"DE-752"
"Pädagogische Hochschule Weingarten (PHW)"	"HBW"	""
"Paul-Ehrlich-Institut, Bibliothek"	"PEI"	"DE-F20"
"Robert Koch-Institut / Bibliothek"	"RKI"	""
"Ruhr-Universität Bochum"	"RUBO"	"DE-294"
"Saarländische Universitäts- und Landesbibliothek"	"SULB"	"DE-291"
"Sächsische Landesbibliothek - Staats- und Universitätsbibliothek Dresden"	"SLUB"	"DE-14"
"Schloss Dagstuhl - Leibniz-Zentrum für Informatik, Bibliothek"	"DAG"	"DE-982"
"S(KIM) - Hochschule Ostwestfalen-Lippe"	"FHLH"	"DE-743"
"Staatliche Bibliothek Neuburg an der Donau"	"SBND"	"DE-150"
"Staatsbibliothek zu Berlin - Preußischer Kulturbesitz"	"SBBPK"	"DE-1a"
"Staats- und Universitätsbibliothek Hamburg und Fachbibliotheken"	"SUBHH"	"DE-18"
"Technische Informationsbibliothek (TIB)"	"UBTIB"	"DE-89"
"Technische Universität München - Universitätsbibliothek"	"TUM"	"DE-91"
"THM Hochschulbibliothek"	"FHGF"	"DE-974"
"Thüringer Universitäts- und Landesbibliothek Jena"	"THULB"	"DE-27"
"Tierärztliche Hochschule Hannover - Bibliothek"	"TIHO"	"DE-95"
"UB der Helmut-Schmidt-Universität Hamburg"	"UBWH"	"DE-705"
"UB Landau der Universitätsbibliothek Koblenz-Landau"	"BIBLA"	""
"Universität der Bundeswehr München"	"UBWM"	"DE-706"
"Universität Marburg"	"UBMA"	"DE-4"
"Universitätsbibliothek Augsburg"	"UBA"	"DE-384"
"Universitätsbibliothek Bamberg"	"UBB"	"DE-473"
"Universitätsbibliothek Bayreuth"	"UBBAY"	"DE-703"
"Universitätsbibliothek Bielefeld"	"UBBIE"	"DE-361"
"Universitätsbibliothek Braunschweig"	"TUBS"	"DE-84"
"Universitätsbibliothek Chemnitz"	"TUCHE"	"DE-Ch1"
"Universitätsbibliothek Clausthal"	"UBCL"	"DE-104"
"Universitätsbibliothek Cottbus-Senftenberg"	"TUCB"	"DE-634"
"Universitätsbibliothek der Bauhaus-Universität Weimar"	"UBBUW"	"DE-Wim2"
"Universitätsbibliothek der FAU Erlangen-Nürnberg"	"UBEN"	"DE-29"
"Universitätsbibliothek der Freien Universität Berlin"	"FUB"	"DE-188-e"
"Universitätsbibliothek der LMU München"	"UBM"	"DE-19"
"Universitätsbibliothek der RWTH Aachen"	"BTHAC"	"DE-82"
"Universitätsbibliothek der TU Berlin"	"TUBB"	"DE-83"
"Universitätsbibliothek Dortmund"	"UBDO"	"DE-290"
"Universitätsbibliothek Duisburg-Essen, Campus Duisburg"	"UBDU"	"DE-464"
"Universitätsbibliothek Duisburg-Essen"	"UGHE"	"DE-465"
"Universitätsbibliothek Eichstätt-Ingolstadt"	"UBE"	"DE-824"
"Universitätsbibliothek Erfurt / Forschungsbibliothek Gotha"	"UBERF"	"DE-547"
"Universitätsbibliothek Freiburg"	"UBFRE"	"DE-25"
"Universitätsbibliothek Greifswald"	"UBGRW"	"DE-9"
"Universitätsbibliothek Hagen"	"FUH"	"DE-708"
"Universitätsbibliothek Heidelberg"	"UBHE"	"DE-16"
"Universitätsbibliothek Hildesheim"	"UBHI"	"DE-Hil2"
"Universitätsbibliothek Ilmenau"	"UBIL"	"DE-Ilm1"
"Universitätsbibliothek Kaiserslautern"	"UBKL"	"DE-386"
"Universitätsbibliothek Kassel"	"UBKAS"	"DE-34"
"Universitätsbibliothek Kiel"	"UBK"	"DE-8"
"Universitätsbibliothek Koblenz-Landau"	"BIBKO"	""
"Universitätsbibliothek Leipzig"	"UBL"	"DE-15"
"Universitätsbibliothek Lüneburg"	"UBLUE"	"DE-Luen4"
"Universitätsbibliothek Magdeburg (einschl. Medizinische Zentralbibliothek)"	"UBMD"	"DE-Ma9"
"Universitätsbibliothek Mannheim"	"UBMAN"	"DE-180"
"Universitätsbibliothek Osnabrück"	"UBOS"	"DE-700"
"Universitätsbibliothek Paderborn"	"UBPB"	"DE-466"
"Universitätsbibliothek Passau"	"UBPA"	"DE-739"
"Universitätsbibliothek Potsdam"	"UBPO"	"DE-517"
"Universitätsbibliothek Regensburg"	"UBR"	"DE-355"
"Universitätsbibliothek Rostock"	"UBRO"	"DE-28"
"Universitätsbibliothek Siegen"	"UBSI"	"DE-467"
"Universitätsbibliothek Trier"	"UBTR"	"DE-385"
"Universitätsbibliothek Tübingen"	"UBTUE"	"DE-21"
"Universitätsbibliothek Vechta"	"UBVE"	"DE-Va1"
"Universitätsbibliothek Wuppertal"	"UBWUP"	"DE-468"
"Universitätsbibliothek Würzburg"	"UBW"	"DE-20"
"Universitätsklinikum Hamburg-Eppendorf"	"UKE"	"DE-18-64"
"Universitäts- und Landesbibliothek Bonn"	"ULBB"	"DE-5"
"Universitäts- und Landesbibliothek Darmstadt"	"TUDA"	"DE-17"
"Universitäts- und Landesbibliothek Düsseldorf"	"ULBD"	"DE-61"
"Universitäts- und Landesbibliothek Münster"	"ULBMS"	"DE-6"
"Universitäts- und Landesbibliothek Sachsen-Anhalt"	"ULBH"	"DE-3"
"Universitäts- und Stadtbibliothek Köln"	"USBK"	"DE-38"
"Universität Ulm / Kommunikations- und Informationszentrum (kiz)"	"UBU"	"DE-289"
"Wissenschaftskolleg zu Berlin"	"WIKO"	""
"Wissenschaftszentrum Berlin für Sozialforschung, Berlin"	"WZB"	"DE-B1543"
"Württembergische Landesbibliothek Stuttgart"	"WLB"	"DE-24"
"ZB MED - Informationszentrum Lebenswissenschaften /  Medizinische Abteilung der USB Köln"	"ZBMED"	"DE-38M"
"ZBW - Deutsche Zentralbibliothek für Wirtschaftswissenschaften - Standort Hamburg"	"HWWA"	"DE-206H"
"ZBW - Deutsche Zentralbibliothek für Wirtschaftswissenschaften - Standort Kiel"	"ZBW"	"DE-206"
"Zentralbibliothek der Fachhochschule Kiel"	"FHKI"	"DE-Ki95"
"Zentrale Hochschulbibliothek Lübeck"	"UBHL"	"DE-841"
